{
  "$schema": "http://json-schema.org/draft-07/schema#",
  "type": "array",
  "minItems": 1,
  "items": {
    "type": "object",
    "required": [
      "month",
      "service",
      "resource_id",
      "region",
      "usage_quantity",
      "unit",
      "cost_inr",
      "desc"
    ],
    "properties": {
      "month": {
        "type": "string"
      },
      "service": {
        "type": "string"
      },
      "resource_id": {
        "type": "string"
      },
      "region": {
        "type": "string"
      },
      "usage_quantity": {
        "type": "number"
      },
      "unit": {
        "type": "string"
      },
      "cost_inr": {
        "type": "number"
      },
      "desc": {
        "type": "string"
      }
    },
    "additionalProperties": true
  }
}
